{
  "trace_id": "ktp-trace-2026-0001",
  "record_version": "0.1.0",
  "created_at": "2026-05-18T10:00:00Z",
  "updated_at": "2026-05-18T10:30:00Z",
  "observer": {
    "type": "ai_agent",
    "name": "Shingen-Tracking-Maru",
    "identifier": "agent:shingen-tracking-maru:v0.1",
    "confidence_policy": "Confidence is estimated from semantic similarity, structural similarity, explicit evidence, and uncertainty notes. It is not treated as final judgment."
  },
  "target": {
    "type": "article",
    "title": "The Future of Trace Intelligence in AI-Mediated Creation",
    "uri": "https://example.com/articles/future-of-trace-intelligence",
    "content_hash": "sha256:target-example-hash-0001",
    "captured_at": "2026-05-18T09:45:00Z",
    "language": "en",
    "summary": "An article discussing how AI-mediated creation requires origin tracking, structural influence detection, review layers, and value allocation systems."
  },
  "origin_candidates": [
    {
      "origin_id": "kazene-origin-001",
      "title": "Kazene Trace Protocol",
      "uri": "https://example.com/origins/kazene-trace-protocol",
      "content_hash": "sha256:origin-example-hash-0001",
      "relation_type": "structural_similarity",
      "confidence": 0.78,
      "evidence_summary": "The target shares a layered structure involving origin identification, trace recording, review or dispute handling, allocation readiness, and royalty-related value circulation.",
      "limitations": "No explicit citation is present. The relationship may reflect general convergence or influence from multiple sources."
    },
    {
      "origin_id": "kazene-origin-002",
      "title": "Structure Fingerprint Specification",
      "uri": "https://example.com/origins/structure-fingerprint-specification",
      "content_hash": "sha256:origin-example-hash-0002",
      "relation_type": "conceptual_influence",
      "confidence": 0.64,
      "evidence_summary": "The target appears to use the idea of comparing structural patterns rather than relying only on surface-level textual similarity.",
      "limitations": "The target does not reproduce the original schema or terminology directly."
    }
  ],
  "evidence": {
    "semantic_similarity_score": 0.72,
    "structure_similarity_score": 0.81,
    "conceptual_similarity_score": 0.76,
    "citation_presence": false,
    "metadata_presence": false,
    "watermark_presence": false,
    "chain_of_custody_presence": false,
    "structure_fingerprint_presence": true,
    "origin_token_presence": false,
    "evidence_items": [
      {
        "evidence_id": "evidence-001",
        "evidence_type": "structure_fingerprint",
        "description": "The target and origin candidate share a similar sequence: origin candidate detection, evidence preservation, review layer, allocation readiness, and royalty system connection.",
        "uri": "https://example.com/evidence/structure-comparison-0001",
        "confidence": 0.81
      },
      {
        "evidence_id": "evidence-002",
        "evidence_type": "semantic_match",
        "description": "Embedding comparison suggests moderate semantic overlap between the target article and the Kazene Trace Protocol description.",
        "confidence": 0.72
      },
      {
        "evidence_id": "evidence-003",
        "evidence_type": "ai_analysis",
        "description": "LLM-assisted review identifies conceptual overlap but recommends human or multi-wing review before any stronger claim is made.",
        "confidence": 0.68
      }
    ]
  },
  "analysis": {
    "method": "hybrid_analysis",
    "summary": "The target appears to be structurally related to Kazene Trace Protocol concepts, especially in its separation of evidence, review, and allocation layers.",
    "reasoning_notes": "The relationship is strongest at the architectural level rather than the wording level. The target does not copy phrases directly but follows a comparable governance flow.",
    "uncertainty_notes": "The similarity may be caused by shared technical trends in provenance, AI governance, or royalty infrastructure rather than direct influence."
  },
  "review_status": {
    "state": "pending",
    "reviewer": "",
    "notes": "This record requires human or multi-wing review before being used in any downstream allocation or governance process."
  },
  "dispute_status": {
    "disputed": false,
    "status": "none"
  },
  "allocation_readiness": {
    "ready": false,
    "reason": "This record is an evidence packet only. It does not establish final origin status and must not trigger automatic royalty allocation.",
    "required_next_step": "multi_wing_review"
  },
  "governance": {
    "policy_reference": "ktp-trace-intelligence-policy-draft-v0.1",
    "jurisdiction": "unspecified",
    "review_body": "human-or-multi-wing-review-process",
    "notes": "This record should be treated as a trace claim for review, not as a legal or financial determination."
  }
}
